{
  "split": "v2/holdout",
  "diagnoser": "real-debugger-v1",
  "case_count": 10,
  "methods": [
    {
      "context_method": "grep",
      "diagnosis_success_rate": 0.9,
      "macro_category_accuracy": 0.5,
      "macro_required_signal_mention_recall": 0.3914,
      "macro_critical_signal_mention_recall": 0.4786,
      "macro_relevant_file_recall": 0.8571,
      "macro_relevant_test_recall": 0.6905,
      "macro_must_mention_coverage": 0.75,
      "macro_forbidden_claim_violations": 0.0,
      "macro_valid_evidence_quote_rate": 0.813,
      "abstention_rate": 0.1,
      "confident_error_rate": 0.4,
      "confident_error_rate_v1_1": 0.0,
      "macro_context_tokens": 24324.2,
      "macro_diagnosis_tokens": 387.5,
      "macro_category_match_score_v1_1": 0.6,
      "diagnosis_score_v1": 0.4735,
      "diagnosis_score_v1_1": 0.5885,
      "cases": [
        {
          "case_id": "biome-pnpm-not-found-v2-001",
          "diagnosis_success": false,
          "provider_error": "RuntimeError: diagnosis command exited 1: diagnosis_shim_claude_cli: RuntimeError: claude CLI exited 1: ''\n",
          "root_cause_category": "unknown",
          "confidence": 0.0,
          "category_accuracy": 0.0,
          "required_signal_mention_recall": 0.0,
          "critical_signal_mention_recall": 0.0,
          "relevant_file_recall": null,
          "relevant_test_recall": null,
          "must_mention_coverage": 0.0,
          "forbidden_claim_violations": [],
          "valid_evidence_quote_rate": null,
          "abstained": true,
          "confident_error": false,
          "category_match_score_v1_1": 0.0,
          "confident_error_v1_1": false,
          "missed_signals": [
            {
              "type": "exception",
              "value": "sh: 1: pnpm: not found",
              "file": null,
              "importance": "critical"
            },
            {
              "type": "command",
              "value": "pnpm format",
              "file": null,
              "importance": "critical"
            },
            {
              "type": "exception",
              "value": "error: Recipe `format` failed on line 221 with exit code 127",
              "file": null,
              "importance": "important"
            },
            {
              "type": "exception",
              "value": "error: Recipe `gen-all` failed on line 32 with exit code 127",
              "file": null,
              "importance": "important"
            },
            {
              "type": "annotation",
              "value": "##[error]Process completed with exit code 127.",
              "file": null,
              "importance": "critical"
            },
            {
              "type": "exit_code",
              "value": "exit code 127",
              "file": null,
              "importance": "important"
            }
          ],
          "context_tokens": 98656,
          "diagnosis_tokens": 55,
          "diagnosis_score_v1": 0.0,
          "diagnosis_score_v1_1": 0.0
        },
        {
          "case_id": "dubbo-samples-test-timeout-batch6-v2-001",
          "diagnosis_success": true,
          "provider_error": null,
          "root_cause_category": "timeout_or_oom",
          "confidence": 0.85,
          "category_accuracy": 1.0,
          "required_signal_mention_recall": 0.2,
          "critical_signal_mention_recall": 0.5,
          "relevant_file_recall": null,
          "relevant_test_recall": 1.0,
          "must_mention_coverage": 1.0,
          "forbidden_claim_violations": [],
          "valid_evidence_quote_rate": 1.0,
          "abstained": false,
          "confident_error": false,
          "category_match_score_v1_1": 1.0,
          "confident_error_v1_1": false,
          "missed_signals": [
            {
              "type": "command",
              "value": "TEST FAILURE: Run tests timeout, version: -Ddubbo.version=3.3.7-SNAPSHOT -Dspring.version=5.3.24 -Djava.version=21",
              "file": null,
              "importance": "critical"
            },
            {
              "type": "exception",
              "value": "Error response from daemon: No such container: dubbo-samples-test-11137--nacos-mysql-1",
              "file": null,
              "importance": "important"
            },
            {
              "type": "command",
              "value": "please check logs: /home/runner/work/dubbo/dubbo/99-integration/dubbo-samples-test-11137/target/logs",
              "file": null,
              "importance": "important"
            },
            {
              "type": "annotation",
              "value": "##[error]Process completed with exit code 1.",
              "file": null,
              "importance": "important"
            }
          ],
          "context_tokens": 16973,
          "diagnosis_tokens": 516,
          "diagnosis_score_v1": 0.75,
          "diagnosis_score_v1_1": 0.75
        },
        {
          "case_id": "gh-cli-go-test-prompter-v2-001",
          "diagnosis_success": true,
          "provider_error": null,
          "root_cause_category": "test_assertion",
          "confidence": 0.65,
          "category_accuracy": 1.0,
          "required_signal_mention_recall": 0.3333,
          "critical_signal_mention_recall": 0.0,
          "relevant_file_recall": 0.0,
          "relevant_test_recall": 0.0,
          "must_mention_coverage": 0.0,
          "forbidden_claim_violations": [],
          "valid_evidence_quote_rate": 1.0,
          "abstained": false,
          "confident_error": false,
          "category_match_score_v1_1": 1.0,
          "confident_error_v1_1": false,
          "missed_signals": [
            {
              "type": "failed_test",
              "value": "TestHuhPrompterMultiSelectWithSearchPersistence/selections_persist_after_changing_search_query",
              "file": null,
              "importance": "critical"
            },
            {
              "type": "assertion",
              "value": "form.Run() did not complete in time",
              "file": null,
              "importance": "critical"
            },
            {
              "type": "stack_location",
              "value": "huh_prompter_test.go:478",
              "file": "huh_prompter_test.go",
              "importance": "important"
            },
            {
              "type": "package",
              "value": "github.com/cli/cli/v2/internal/prompter",
              "file": null,
              "importance": "important"
            }
          ],
          "context_tokens": 258,
          "diagnosis_tokens": 231,
          "diagnosis_score_v1": 0.3,
          "diagnosis_score_v1_1": 0.3
        },
        {
          "case_id": "go-redis-pubsub-channel-timeout-batch5-v2-001",
          "diagnosis_success": true,
          "provider_error": null,
          "root_cause_category": "other",
          "confidence": 0.82,
          "category_accuracy": 0.0,
          "required_signal_mention_recall": 0.4286,
          "critical_signal_mention_recall": 0.2857,
          "relevant_file_recall": 1.0,
          "relevant_test_recall": 0.5,
          "must_mention_coverage": 1.0,
          "forbidden_claim_violations": [],
          "valid_evidence_quote_rate": 0.5,
          "abstained": false,
          "confident_error": true,
          "category_match_score_v1_1": 0.0,
          "confident_error_v1_1": false,
          "missed_signals": [
            {
              "type": "failed_test",
              "value": "[FAILED] [1.014 seconds]",
              "file": null,
              "importance": "critical"
            },
            {
              "type": "failed_test",
              "value": "PubSub [It] should ChannelMessage",
              "file": null,
              "importance": "critical"
            },
            {
              "type": "command",
              "value": "Summarizing 1 Failure:",
              "file": null,
              "importance": "important"
            },
            {
              "type": "command",
              "value": "[FAIL] PubSub [It] should ChannelMessage",
              "file": null,
              "importance": "critical"
            },
            {
              "type": "command",
              "value": "FAIL! -- 1223 Passed | 1 Failed | 0 Pending | 50 Skipped",
              "file": null,
              "importance": "critical"
            },
            {
              "type": "command",
              "value": "--- FAIL: TestGinkgoSuite (179.28s)",
              "file": null,
              "importance": "critical"
            },
            {
              "type": "command",
              "value": "FAIL\tgithub.com/redis/go-redis/v9\t185.245s",
              "file": null,
              "importance": "important"
            },
            {
              "type": "annotation",
              "value": "##[error]Process completed with exit code 2.",
              "file": null,
              "importance": "important"
            }
          ],
          "context_tokens": 22350,
          "diagnosis_tokens": 398,
          "diagnosis_score_v1": 0.2107,
          "diagnosis_score_v1_1": 0.4607
        },
        {
          "case_id": "gradle-projecthealth-batch5-v2-001",
          "diagnosis_success": true,
          "provider_error": null,
          "root_cause_category": "test_assertion",
          "confidence": 0.9,
          "category_accuracy": 0.0,
          "required_signal_mention_recall": 0.7143,
          "critical_signal_mention_recall": 1.0,
          "relevant_file_recall": 1.0,
          "relevant_test_recall": 1.0,
          "must_mention_coverage": 1.0,
          "forbidden_claim_violations": [],
          "valid_evidence_quote_rate": 0.75,
          "abstained": false,
          "confident_error": true,
          "category_match_score_v1_1": 0.5,
          "confident_error_v1_1": false,
          "missed_signals": [
            {
              "type": "command",